image_id,filename,filepath,split,caption,label,all_captions_json
flickr30k_0000,1000092795.jpg,data/bootstrap_flickr30k/images/1000092795.jpg,bootstrap,Two young guys with shaggy hair look at their hands while hanging out in the yard.,people_outdoors,"[""Two young guys with shaggy hair look at their hands while hanging out in the yard."", ""Two young, White males are outside near many bushes."", ""Two men in green shirts are standing in a yard."", ""A man in a blue shirt standing in a garden."", ""Two friends enjoy time spent together.""]"
flickr30k_0001,10002456.jpg,data/bootstrap_flickr30k/images/10002456.jpg,bootstrap,Several men in hard hats are operating a giant pulley system.,industrial_workers,"[""Several men in hard hats are operating a giant pulley system."", ""Workers look down from up above on a piece of equipment."", ""Two men working on a machine wearing hard hats."", ""Four men on top of a tall structure."", ""Three men on a large rig.""]"
flickr30k_0002,1000268201.jpg,data/bootstrap_flickr30k/images/1000268201.jpg,bootstrap,A child in a pink dress is climbing up a set of stairs in an entry way.,child_play,"[""A child in a pink dress is climbing up a set of stairs in an entry way."", ""A little girl in a pink dress going into a wooden cabin."", ""A little girl climbing the stairs to her playhouse."", ""A little girl climbing into a wooden playhouse."", ""A girl going into a wooden building.""]"
flickr30k_0003,1000344755.jpg,data/bootstrap_flickr30k/images/1000344755.jpg,bootstrap,A man on a ladder cleans a window.,maintenance,"[""Someone in a blue shirt and hat is standing on stair and leaning against a window."", ""A man in a blue shirt is standing on a ladder cleaning a window."", ""A man on a ladder cleans the window of a tall building."", ""Man in blue shirt and jeans on ladder cleaning windows"", ""A man on a ladder cleans a window.""]"
flickr30k_0004,1000366164.jpg,data/bootstrap_flickr30k/images/1000366164.jpg,bootstrap,Two men are cooking a meal.,cooking,"[""Two men, one in a gray shirt, one in a black shirt, standing near a stove."", ""Two guy cooking and joking around with the camera."", ""Two men in a kitchen cooking food on a stove."", ""Two men are at the stove preparing food."", ""Two men are cooking a meal.""]"
flickr30k_0005,1000523639.jpg,data/bootstrap_flickr30k/images/1000523639.jpg,bootstrap,A man is fixing the guitar player's costume.,performance,"[""Two people in the photo are playing the guitar and the other is poking at him."", ""A man in green holds a guitar while the other man observes his shirt."", ""A man is fixing the guitar player's costume."", ""A guy stitching up another man's coat."", ""The two boys playing guitar""]"
